#,Title,Category,Language,Channel,Published,Status,Format,URL
297,PAG-GAMIT NG HINGE THEOREM SA PAG-SOLVE NG TRIANGLE INEQUALITIES | GEOMETRY,Algebra,Filipino,Numberbender (Main),2022-04-07,unique,,https://www.youtube.com/watch?v=lQBED00UEKY
298,PAG-GAMIT NG TRIANGLE INEQUALITY THEOREM | GEOMETRY,Statistics,Filipino,Numberbender (Main),2022-04-06,unique,,https://www.youtube.com/watch?v=aYnFK4VkTUM
299,PAG-CONSTRUCT NG ANGLE AND PERPENDICULAR BISEECTORS | GEOMETRY,Algebra,Filipino,Numberbender (Main),2022-04-05,unique,,https://www.youtube.com/watch?v=CmxrwgrIeEA
300,PAG-GAMIT NG CPCTC THEOREM SA PAG-PROVE NG CONGRUENCY NG MGA TRIANGLES | GEOMETRY,Statistics,English,Numberbender (Main),2022-04-04,unique,,https://www.youtube.com/watch?v=ulr5V9EBZlU
301,PAG-GAMIT NG AAS AND ASA POSTULATES SA PAG-PROVE NG CONGRUENCY SA TRIANGLES | GEOMETRY,Geometry,Filipino,Numberbender (Main),2022-04-01,unique,,https://www.youtube.com/watch?v=jkY5g0Mwqfc
302,PAG-PROVE AT PAG-IDENTIFY NG CONGRUENCY GAMIT ANG SSS AND SAS POSTULATES | GEOMETRY,Geometry,Filipino,Numberbender (Main),2022-03-31,unique,,https://www.youtube.com/watch?v=eJvx9AFRwBs
303,PAG-PROVE NG CONGRUENCY NG TRIANGLES | GEOMETRY,Algebra,Filipino,Numberbender (Main),2022-03-30,unique,,https://www.youtube.com/watch?v=2u586kAGdSo
304,PAANO MAGCLASSIFY NG TRIANGLE | GEOMETRY,Algebra,Filipino,Numberbender (Main),2022-03-28,unique,,https://www.youtube.com/watch?v=8VIt_oIER3o
305,AXIOMATIC STRUCTURE OF A MATHEMATICAL SYSTEM | GEOMETRY,Geometry,Filipino,Numberbender (Main),2022-03-22,unique,horizontal,https://www.youtube.com/watch?v=B8Spo9LkyGQ
306,PAANO MAGSULAT NG ISANG TWO-COLUMN PROOF | GEOMETRY,Algebra,Filipino,Numberbender (Main),2022-03-21,unique,,https://www.youtube.com/watch?v=tvC8HUhocVU
307,PAG-GAMIT NG LAW OF DETACHMENT SA DEDUCTIVE REASONING | GEOMETRY,Statistics,Filipino,Numberbender (Main),2022-03-18,unique,,https://www.youtube.com/watch?v=pckXraym8Co
308,KAILAN BA ANG BICONDITIONAL STATEMENT AY TRUE | GEOMETRY,Statistics,English,Numberbender (Main),2022-03-17,unique,,https://www.youtube.com/watch?v=m62l0EdtNmg
309,"INVERSE, CONVERSE, AND CONTRAPOSITIVE STATEMENTS NG CONDITIONAL STATEMENT | GEOMETRY",Statistics,Filipino,Numberbender (Main),2022-03-16,unique,,https://www.youtube.com/watch?v=YatkBVfX24U
310,KAILAN TRUE OR FALSE AND ISANG CONDITIONAL STATEMENT | GEOMETRY,Statistics,English,Numberbender (Main),2022-03-15,unique,,https://www.youtube.com/watch?v=FsQyUTQmtPM
311,PAG-GAMIT NG LOGIC COJECTURE AT INDUCTIVE REASONING SA ANALYTICAL THINKING | GEOMETRY,Geometry,Filipino,Numberbender (Main),2022-03-14,unique,,https://www.youtube.com/watch?v=YZ5lVer6VJA
312,PAG-GAMIT NG MGA THEOREMS NG CHORDS AND ARCS NG MGA CONGRUENT CIRCLES | GEOMETRY,Geometry,English,Numberbender (Main),2022-03-08,unique,,https://www.youtube.com/watch?v=DdYpgDQ7x78
313,PAGSOLVE NG NG MGA INSCRIBED CIRCLES AND TANGENT LINES | GEOMETRY,Algebra,Filipino,Numberbender (Main),2022-03-07,unique,,https://www.youtube.com/watch?v=F3n88ZgKWGQ
314,PAGSOLVE NG ARC LENGTH AND ARC MEASURE NG ISANG CIRCLE | GEOMETRY,Geometry,Filipino,Numberbender (Main),2022-03-03,unique,,https://www.youtube.com/watch?v=dWIUWmSbn_Q
315,PAGSOLVE NG WORD PROBLEMS GAMIT ANG LAW OF COSINES,Trigonometry,Filipino,Numberbender (Main),2022-03-01,unique,,https://www.youtube.com/watch?v=PplF4PvjBc0
316,"HIKING SA NAGYEYELONG WATERFALLS NG SWEDEN | TANNFORSEN FALL, ÅRE",General / Other,English,Numberbender (Main),2022-02-07,unique,,https://www.youtube.com/watch?v=ppFRxMw6h98
317,FIRST TIME MAG-SKI SA NORTHERN SWEDEN | ÅRE,General / Other,Filipino,Numberbender (Main),2022-01-24,unique,,https://www.youtube.com/watch?v=2AV-CQ1dw6k
318,CHRISTMAS BREAK SA STOCKHOLM SA GITNA NG PANDEMYA,General / Other,English,Numberbender (Main),2022-01-17,unique,,https://www.youtube.com/watch?v=YEVkDziJbd8
319,PAG-SOLVE NG WORD PROBLEMS ON OBLIQUE TRIANGLES GAMIT ANG LAW OF SINES | GEOMETRY TRIGONOMETRY,Trigonometry,Filipino,Numberbender (Main),2021-11-29,unique,,https://www.youtube.com/watch?v=LgruYVFOj7g
320,PAANO MAG-SOLVE NG WORD PROBLEMS INVOLVING RIGHT TRIANGLES GAMIT ANG SOHCAHTOA | GEOMETRY,Trigonometry,Filipino,Numberbender (Main),2021-11-28,unique,,https://www.youtube.com/watch?v=BVTCaRfd1h4
321,PAG-IDENTIFY NG SIMILARITY NG RIGHT TRIANGLES GIVEN ITS ALTITUDE | GEOMETRY,Algebra,Filipino,Numberbender (Main),2021-11-27,unique,,https://www.youtube.com/watch?v=4PtAydUdOhM
322,"PAG-SOLVE NG SIMILARITY NG TRIANGLES GAMIT ANG AA, SAS, AT SSS SIMILARITY THEOREM | GEOMETRY",Geometry,English,Numberbender (Main),2021-11-26,unique,,https://www.youtube.com/watch?v=XRX74dDcsfY
323,PAG-DETERMINE NG SIMILARITY NG MGA POLYGONS | GEOMETRY,Geometry,English,Numberbender (Main),2021-11-25,unique,,https://www.youtube.com/watch?v=I6zjdEFxINM
324,PAGSOLVE NG WORD PROBLEMS GAMIT ANG PROPORTION PROPERTIES PROPERTIES | GEOMETRY,Algebra,Filipino,Numberbender (Main),2021-11-24,unique,,https://www.youtube.com/watch?v=7UnD_IAB8I8
325,PAGSOLVE NG MGA RATIO AND PROPORTION PROBLEMS ON SIMILARITY | GEOMETRY,Algebra,Filipino,Numberbender (Main),2021-11-23,unique,,https://www.youtube.com/watch?v=3oMkVfXcWYg
326,PAGSULAT NG TWO-COLUMN PROOF NG KITE AND TRAPEZOID | GEOMETRY,Geometry,English,Numberbender (Main),2021-11-22,unique,,https://www.youtube.com/watch?v=bK-F_eJiNWE
327,PAG-SOLVE NG KITE AT TRAPEZOID GAMIT AND MIDLINE THEOREM | GEOMETRY,Algebra,English,Numberbender (Main),2021-11-21,unique,,https://www.youtube.com/watch?v=EtpTE28Tj7A
328,PAANO MAG-SOLVE NG PARALLELOGRAMS GAMIT ANG PROPERTIES AT CONDITIONS NITO | GEOMETRY,Algebra,Filipino,Numberbender (Main),2021-11-20,unique,horizontal,https://www.youtube.com/watch?v=iGolbbwfY7E
329,PAG-SOLVE NG TRAPEZOID GAMIT ANG MIDLINE OR MIDSEGMENT THEOREM | GEOMETRY,Algebra,Filipino,Numberbender (Main),2021-11-19,unique,,https://www.youtube.com/watch?v=6CWgz9UobgU
330,PAG-SOLVE NG KITE GAMIT ANG MGA PROPERTIES AT THEOREMS NITO | GEOMETRY,Algebra,English,Numberbender (Main),2021-11-18,unique,,https://www.youtube.com/watch?v=zTwlS4WO44Y
331,SOLVING TRAPEZOID GAMIT ANG MGA PROPERTIES NITO | GEOMETRY,Algebra,English,Numberbender (Main),2021-11-17,unique,,https://www.youtube.com/watch?v=OfUwoEHH4r4
332,"PAG-SOLVE NG MGA RECTANGLE, RHOMBUS, AT SQUARES GAMIT ANG PROPERTIES NITO | GEOMETRY",Algebra,English,Numberbender (Main),2021-11-16,unique,,https://www.youtube.com/watch?v=9vXNIhWXET4
333,PAANO MAG-SOLVE NG PARALLELOGRAMS GAMIT ANG PROPERTIES AT CONDITIONS NITO | GEOMETRY,Algebra,Filipino,Numberbender (Main),2021-11-15,duplicate,vertical,https://www.youtube.com/watch?v=h17vAySwk00
334,MGA CONDITIONS TO CLASSIFY NA ANG QUADRILATERAL AY ISANG PARALLELOGRAM | GEOMETRY,Algebra,Filipino,Numberbender (Main),2021-11-14,unique,,https://www.youtube.com/watch?v=0YLe7WWemZI
335,PAANO MAG-SAGOT NG WORD PROBLEMS ON COMBINED VARIATION | ALGEBRA,Statistics,Filipino,Numberbender (Main),2021-11-13,unique,,https://www.youtube.com/watch?v=61SJw0qeM6A
336,PAANO MAG-SOLVE NG MGA WORD PROBLEMS ON JOINT VARIATION | ALGEBRA,Algebra,Filipino,Numberbender (Main),2021-11-12,unique,,https://www.youtube.com/watch?v=kPkpywEVDBM
337,PAANO MAG-SOLVE NG MGA WORD PROBLEMS ON INVERSE VARIATION | ALGEBRA,Algebra,Filipino,Numberbender (Main),2021-11-11,unique,,https://www.youtube.com/watch?v=1FyLXwZKVQg
338,PAANO MAGSAGOT NG MGA DIRECT VARIATION PROBLEMS | ALGEBRA,Algebra,Filipino,Numberbender (Main),2021-11-10,unique,,https://www.youtube.com/watch?v=vHvAuX6k4Gs
339,PAANO MAG-SOLVE NG MGA WORD PROBLEMS INVOLVING QUADRATIC EQUATIONS | ALGEBRA,Statistics,Filipino,Numberbender (Main),2021-11-09,unique,,https://www.youtube.com/watch?v=o8zIVFga0L0
340,PAANO ISULAT ANG QUADRATIC EQUATION GIVEN ITS TABLE OF VALUES | ALGEBRA,Algebra,Filipino,Numberbender (Main),2021-11-07,unique,,https://www.youtube.com/watch?v=t1Gm_d3PTSc
341,PAANO ISULAT ANG EQUATION NG PARABOLA GAMIT ANG SOLUTIONS NG QUADRATIC | ALGEBRA,Algebra,Filipino,Numberbender (Main),2021-11-07,unique,,https://www.youtube.com/watch?v=w9TlES1xi-o
342,PAANO ISULAT ANG EQUATION NG QUADRATICS GIVEN ITS VERTEX AT POINT | ALGEBRA,Algebra,Filipino,Numberbender (Main),2021-11-06,unique,,https://www.youtube.com/watch?v=MuiwYBfcKDY
343,TRANSFORMATION NG PARABOLA GAMIT NG VERTEX FORM NG QUADRATICS | ALGEBRA,Algebra,Filipino,Numberbender (Main),2021-11-05,unique,,https://www.youtube.com/watch?v=Kzvfs-iNPe8
344,PAANO MAG-CONVERT NG QUADRATIC EQUATION TO ITS VERTEX FORM | ALGEBRA,Statistics,Filipino,Numberbender (Main),2021-11-04,unique,,https://www.youtube.com/watch?v=7dx-LH7aCqY
345,"PAANO MAG-ANALZYE NG QUADRATIC FUNCTIONS, ANALYTICALY AND GRAPHICALLY | ALGEBRA",Algebra,Filipino,Numberbender (Main),2021-11-03,unique,,https://www.youtube.com/watch?v=U6iyvl0ZW_0
346,PAANO MAG-SOLVE NG MGA WORD PROBLEMS INVOLVING QUADRATIC INEQUALITIES | ALGEBRA,Algebra,Filipino,Numberbender (Main),2021-11-02,duplicate,,https://www.youtube.com/watch?v=gQs5htPgmsQ
347,PAANO MAG-SOLVE NG SOLUTIONS NG QUADRATIC INEQUALITIES | ALGEBRA,Algebra,Filipino,Numberbender (Main),2021-11-01,unique,,https://www.youtube.com/watch?v=gi540Nt-LU4
348,PAANO MAG-ANALYZE NG RATIONAL FUNCTIONS GAMIT ANG TECHNOLOGY | MATH TEACHING TIPS,Algebra,Filipino,Numberbender (Main),2021-10-26,unique,,https://www.youtube.com/watch?v=smgOj1HX6_s
349,PAG-GAMIT NG DESMOS SA PAG-SOLVE NG MGA FACTORABLE EQUATIONS  | MATH TEACHING TIPS,Algebra,English,Numberbender (Main),2021-10-25,unique,,https://www.youtube.com/watch?v=UXHAaGi-mTg
350,PAANO MAGCOMPUTE NG ONE-VARIABLE STATISTICS GAMIT ANG WEB APPLICATION,Statistics,Filipino,Numberbender (Main),2021-10-21,unique,,https://www.youtube.com/watch?v=Fu0qvXMkq8s
351,PAANO MAG-SAGOT NG NORMAL PROBABILITY GAMIT ANG FREE WEB APP | MATH TEACHING TIPS,Statistics,Filipino,Numberbender (Main),2021-10-20,unique,,https://www.youtube.com/watch?v=Sx58shTEClE
352,PAANO GUMAMIT NG DESMOS SA PAG-GAWA NG LINEAR REGRESSION ANALYSIS | MATH TEACHING TIPS,Statistics,Filipino,Numberbender (Main),2021-10-19,unique,,https://www.youtube.com/watch?v=7AIC1XcT2-k
353,WEB APP NA PUWEDENG GAMITIN SA PAG-SOLVE NG MATRIX OPERATIONS  | MATH TEACHING TIPS,Algebra,Filipino,Numberbender (Main),2021-10-15,unique,,https://www.youtube.com/watch?v=gURNcWqe6zg
354,PAANO MO MACHECHECK KUNG TAMA ANG SAGOT MO SA DERIVATIVE RULES NG CALCULUS | MATH TEACHING TIPS,Calculus,Filipino,Numberbender (Main),2021-10-14,unique,,https://www.youtube.com/watch?v=QsNCLLC32fc
355,PAANO MAG-SAGOT NG MGA ALGEBRAIC EQUATIONS USING TECHNOLOGY  | MATH TEACHING TIPS,Algebra,Filipino,Numberbender (Main),2021-10-12,unique,,https://www.youtube.com/watch?v=L9vBbJY-GQ8
356,PAANO GUMAMIT NG TECHNOLOGY AT CALCULUS TO ANALYZE QUADRATICS OR PARABOLA | MATH TEACHING TIPS,Calculus,Filipino,Numberbender (Main),2021-10-09,unique,,https://www.youtube.com/watch?v=DRoN22VTp2E
357,PAANO GAMITIN ANG TWO-WAY TABLE SA PAGSAGOT NG MGA PROBABILITY QUESTIONS | MATH TEACHING TIPS,Statistics,Filipino,Numberbender (Main),2021-10-08,unique,,https://www.youtube.com/watch?v=MjYU22yHs7g
358,PAANO MAGSAGOT NG MGA PROBLEMS INVOLVING SEQUENCES AND SERIES | MATH TEACHING TIPS,Precalculus,Filipino,Numberbender (Main),2021-10-07,unique,,https://www.youtube.com/watch?v=b1ILM1QdT5U
359,PAANO MO MAKIKITA ANG MGA IMAGINARY NUMBERS? | MATH TEACHING TIPS,General / Other,Filipino,Numberbender (Main),2021-10-05,unique,,https://www.youtube.com/watch?v=ydWftD2ssQ4
360,PAANO MAPADALI ANG PAGSOSOLVE NG MGA LIMITS OF A FUNCTION SA CALCULUS | MATH TEACHING TIPS,Calculus,Filipino,Numberbender (Main),2021-10-01,unique,,https://www.youtube.com/watch?v=bw4vc3BU_-Q
361,PAANO GINAGAMIT ANG REIMANN SUMS TO UNDERSTAND INTEGRAL CALCULUS | MATH TEACHING TIPS,Calculus,Filipino,Numberbender (Main),2021-09-30,unique,,https://www.youtube.com/watch?v=fMfe_bKgwCI
362,PAANO MAGSOLVE NG LINEAR SYSTEMS WITH 3 VARIABLES USING A MATRIX | MATH TEACHING TIPS,Algebra,Filipino,Numberbender (Main),2021-09-29,unique,,https://www.youtube.com/watch?v=86YkRtZGIuU
363,BAKIT MAHALAGA ANG COMPLETING THE SQUARES SA ANALYTIC GEOMETRY | MATH TEACHING TIPS,Calculus,English,Numberbender (Main),2021-09-28,unique,,https://www.youtube.com/watch?v=B_lAfSVZHFY
364,PAANO GAMITIN ANG FACTORING TECHNIQUES SA MGA TRIGONOMETRIC IDENTITIES | MATH TEACHING TIPS,Algebra,Filipino,Numberbender (Main),2021-09-24,unique,,https://www.youtube.com/watch?v=MCvalOC_m2k
365,PAANO GUMAMIT NG ZERO PAIRS AT NUMBERLINE SA PAGSOLVE NG PROBLEMS ON INTEGERS | MATH TEACHING TIPS,Algebra,Filipino,Numberbender (Main),2021-09-22,unique,,https://www.youtube.com/watch?v=dZ2hwfKMIrk
366,PAANO GAMITIN ANG LAW OF EXPONENTS SA CALCULUS | MATH TEACHING TIPS,Calculus,Filipino,Numberbender (Main),2021-09-21,unique,,https://www.youtube.com/watch?v=CTeWpAw8_GE
367,PAANO MAGSOLVE NG MGA RATIONAL EXPRESSIONS SA AGEBRA | MATH TEACHING TIPS,Algebra,Filipino,Numberbender (Main),2021-09-19,unique,,https://www.youtube.com/watch?v=7Qcw-JRp2vM
368,PAANO BA MAGSOLVE NG TRIGONOMETRIC EQUATIONS GAMIT ANG ALGEBRA? | MATH TEACHING TIPS,Calculus,Filipino,Numberbender (Main),2021-09-17,unique,,https://www.youtube.com/watch?v=B279aV0jT5Q
369,PAANO ARALIN/ITURO ANG DERIVATIVES SA CALCULUS GAMIT ANG ALGEBRA | MATH TEACHING TIPS,Calculus,Filipino,Numberbender (Main),2021-09-16,unique,,https://www.youtube.com/watch?v=8CSdXsTtoSw
370,ANONG MERON SA MOSABACKE TORG SA STOCKHOLM? | SUMMER '21 VLOG,General / Other,English,Numberbender (Main),2021-08-25,unique,,https://www.youtube.com/watch?v=1VXOxfR_mLg
371,BIGLAANG SWIMMING SA NAGYEYELONG TUBIG NG STOCKHOLM | SUMMER '21 VLOG | PART 2,General / Other,English,Numberbender (Main),2021-08-19,unique,,https://www.youtube.com/watch?v=ZLLpArV1_GE
372,NAG BOATING SA STOCKHOLM | SUMMER '21 VLOG | Part 1,General / Other,Filipino,Numberbender (Main),2021-08-17,unique,,https://www.youtube.com/watch?v=TyoYfY-54Ds
373,PASYAL VLOG SA GAMLA STAN. ANONG MERON SA STOCKHOLM? | SUMMER OF '21 VLOG,Precalculus,English,Numberbender (Main),2021-08-12,unique,,https://www.youtube.com/watch?v=kuvUJf-jBOQ
374,BYAHENG EUROPE SA GITNA NG PANDEMYA | SUMMER VLOG '21,General / Other,Filipino,Numberbender (Main),2021-08-09,unique,,https://www.youtube.com/watch?v=kzyC6t7fG_I
375,PANDEMIC MODE SA NYC | Summer Vlog '21,General / Other,English,Numberbender (Main),2021-08-04,unique,,https://www.youtube.com/watch?v=bKOuA3SQArM
376,NAG 4TH OF JULY SA WASHINGTON DC | Summer Vlog of 2021,Geometry,Filipino,Numberbender (Main),2021-08-02,unique,,https://www.youtube.com/watch?v=BXk_Xw8672U
377,IMAGINARY NUMBERS | Paano Gumaling sa Math,Discrete Math,Filipino,Numberbender (Main),2021-07-26,unique,,https://www.youtube.com/watch?v=wj0N248DHU4
378,Practice Lang,General / Other,English,Numberbender (Main),2021-07-25,unique,,https://www.youtube.com/watch?v=2AlVuJX5q5I
379,LAW OF EXPONENTS | Paano Gumaling sa Math,Calculus,Filipino,Numberbender (Main),2021-07-19,unique,,https://www.youtube.com/watch?v=-InvBwQohn8
380,COMMON MATH MISTAKES | Paano Gumaling sa Math,General / Other,Filipino,Numberbender (Main),2021-07-12,unique,,https://www.youtube.com/watch?v=X_vundRgIOQ
381,REHEARSAL,General / Other,English,Numberbender (Main),2021-07-11,unique,,https://www.youtube.com/watch?v=d-eKjDbrI1Q
382,PART 2: SYMBOLIC LOGIC - THE TRUTH ABOUT THE TRUTH TABLE | Paano Gumaling sa Math,Statistics,Filipino,Numberbender (Main),2021-07-05,unique,,https://www.youtube.com/watch?v=moh0Z2sD6iM
383,SYMBOLIC LOGIC: THE TRUTH ABOUT TRUTH TABLES |Paano Gumaling sa Math,Discrete Math,Filipino,Numberbender (Main),2021-06-28,unique,,https://www.youtube.com/watch?v=7gzQxCqPZHY
384,VENN DIAGRAM: OUR GATEWAY TO SET LOGIC |Paano Gumaling sa Math,Discrete Math,Filipino,Numberbender (Main),2021-06-21,unique,,https://www.youtube.com/watch?v=_-n8Sz8UaQQ
385,EQUIPMENT REVEAL + EMPIRICAL PROBABILITY | Paano Gumaling sa Math | 11am,Statistics,Filipino,Numberbender (Main),2021-06-14,unique,,https://www.youtube.com/watch?v=tkggp_DWdn8
386,REHEARSAL for JUNE 14  LIVE,General / Other,English,Numberbender (Main),2021-06-13,unique,,https://www.youtube.com/watch?v=o9Mpp5VTHfE
387,CONDITIONAL PROBABILITY--WHAT ARE THE ODDS? | Paano Gumaling Sa Math?,Statistics,Filipino,Numberbender (Main),2021-06-07,unique,,https://www.youtube.com/watch?v=rZpAhmy8KFg
388,PRACTICE for Numberbender LIVE tomorrow,General / Other,English,Numberbender (Main),2021-06-06,unique,,https://www.youtube.com/watch?v=bXT1w6wS8UY
389,"PERMUTATION AND COMBINATION, CAN YOU TELL THE DIFFERENCE? | Paano Gumaling sa Math",Statistics,Filipino,Numberbender (Main),2021-05-31,unique,,https://www.youtube.com/watch?v=qR0oUz9U7S0
390,TRAVELING SAFELY SA LAS VEGAS SA GITNA NG PANDEMYA  | VLOG #64,General / Other,English,Numberbender (Main),2021-05-31,unique,,https://www.youtube.com/watch?v=rHKfMmEJBlw
391,"Rehearsal for May 31st 10:30 am,  Lunes",General / Other,Filipino,Numberbender (Main),2021-05-30,unique,,https://www.youtube.com/watch?v=ClmwzCtWCyE
392,ANGLE CONVERSION: DEGREE AND RADIAN MEASURES | Paano Gumaling sa Math,Trigonometry,Filipino,Numberbender (Main),2021-05-24,unique,,https://www.youtube.com/watch?v=TIGUUDhBHuM
393,REHEARSAL for May 24 Monday Live @10:30am,General / Other,English,Numberbender (Main),2021-05-23,unique,,https://www.youtube.com/watch?v=zuY_RdVp-kE
394,DOMAIN AND RANGE: How far can you go? | Paano Gumaling sa Math,Algebra,Filipino,Numberbender (Main),2021-05-17,unique,,https://www.youtube.com/watch?v=3PhoHruuJPU
395,PRACTICE livestream for MONDAY LIVE,General / Other,English,Numberbender (Main),2021-05-16,unique,,https://www.youtube.com/watch?v=iyGPMCFucHs
396,"FINDING YOUR ""X"" IN AN ANGLE | Paano Gumaling Sa Math",Algebra,Filipino,Numberbender (Main),2021-05-10,unique,,https://www.youtube.com/watch?v=XGV0GD9Jv_E
397,"SOLVING QUADRATICS: TWICE THE CHALLENGE, TWICE THE FUN | Paano Gumaling Sa Math",Algebra,Filipino,Numberbender (Main),2021-05-03,unique,,https://www.youtube.com/watch?v=m-2o3SoRDFM
398,SIMPLE AND RATIONAL: math on fractions and factoring | Paano Gumaling Sa Math,Algebra,Filipino,Numberbender (Main),2021-04-26,unique,,https://www.youtube.com/watch?v=0MmWojTBd04
399,"PRACTICE LANG-- see you later sa LIVE at 10:30am, MANILA",General / Other,English,Numberbender (Main),2021-04-25,unique,,https://www.youtube.com/watch?v=9MjUeRBXFcM
400,FINDING YOUR COMPLICATED X | Paano Gumaling Sa Math,Algebra,Filipino,Numberbender (Main),2021-04-19,unique,,https://www.youtube.com/watch?v=14IUXOGtE5M
401,FACTORING: UNDOING THE PRODUCT OF MULTIPLICATION | Paano Gumaling sa Math,Algebra,Filipino,Numberbender (Main),2021-04-12,unique,,https://www.youtube.com/watch?v=sccu79u-vLE
402,BIRTHDAY MUKBANG with Q&A SA BARSTOW | VLOG #63,General / Other,English,Numberbender (Main),2021-04-12,unique,,https://www.youtube.com/watch?v=2KrNQcdYqX4
403,REHEARSAL for MONDAY KUMU LIVE: FACTORING,Algebra,English,Numberbender (Main),2021-04-11,unique,,https://www.youtube.com/watch?v=yLrQqZ-9X_I
404,IMAGINARY NUMBERS: CALCULATING NUMBERS THAT DON'T EXIST | Paano Gumaling sa Math,Algebra,Filipino,Numberbender (Main),2021-04-05,unique,,https://www.youtube.com/watch?v=-oSF3N8Knw4
405,STREAMING IS NOT JUST FOR GAMERS | World Education Summit 2021 #WorldEDSummit,Calculus,English,Numberbender (Main),2021-04-05,unique,,https://www.youtube.com/watch?v=xbN8qDKGlA0
406,INTEGRALS: WHOSE AREA IS IT?  | CALCULUS SERIS 3 | Paano Gumaling,Calculus,Filipino,Numberbender (Main),2021-03-22,unique,,https://www.youtube.com/watch?v=WR7ySkBRnjU
407,REHEARSAL for Kumu LIVE 3-19-21,General / Other,English,Numberbender (Main),2021-03-18,unique,,https://www.youtube.com/watch?v=9y7i5nt-X4Q
408,DERIVATIVES: HOW STEEP IS YOUR SLOPE? | Calculus LIVE | Paano Gumaling sa Math,Calculus,Filipino,Numberbender (Main),2021-03-15,unique,,https://www.youtube.com/watch?v=esKyjRZ8PCU
409,REHEARSAL for KUMU LIVE | Derivatives,Calculus,English,Numberbender (Main),2021-03-11,unique,,https://www.youtube.com/watch?v=CFC4tJLM0wQ
410,Does your LIMIT exist? | Calculus LIVE | Paano Gumaling sa Math,Calculus,Filipino,Numberbender (Main),2021-03-08,unique,,https://www.youtube.com/watch?v=7SoPXj1vKFg
411,REHEARSAL Limit Lecture for Friday 3/521,Calculus,English,Numberbender (Main),2021-03-04,unique,,https://www.youtube.com/watch?v=Ih-afVwitxs
412,CALCULUS LIVE INVITE | Does your LIMIT exist? | #CalculusOnline,Calculus,English,Numberbender (Main),2021-03-02,unique,,https://www.youtube.com/watch?v=oxlvtxEM9Zk
413,LOGARITHMS: Seeing Exponents in a different Perspective|Paano Gumaling sa Math,Algebra,Filipino,Numberbender (Main),2021-03-01,unique,,https://www.youtube.com/watch?v=wt5Fh1u4mfw
414,RATIO AND PROPORTION: Answering Word Problems | Paano Gumaling sa Math | LIVE,Algebra,Filipino,Numberbender (Main),2021-02-22,unique,,https://www.youtube.com/watch?v=ggOIoMfRbd0
415,"TEST BROADCAST for kumu LIVE, feb 19th Friday",General / Other,English,Numberbender (Main),2021-02-18,unique,,https://www.youtube.com/watch?v=o_1eqXLlFpc
416,COMMON MATH MISTAKES... AND HOW TO AVOID THEM | Paano Gumaling sa Math | LIVE,General / Other,Filipino,Numberbender (Main),2021-02-15,unique,,https://www.youtube.com/watch?v=bv_wKl1LKMg
417,BRINGING ORDER TO POWER | Law of Exponents | Paano Gumaling sa Math,Algebra,Filipino,Numberbender (Main),2021-02-08,unique,,https://www.youtube.com/watch?v=vrNgCzbMPPw
418,DECIPHERING MATH CODES,Calculus,Filipino,Numberbender (Main),2021-02-01,unique,,https://www.youtube.com/watch?v=yMyyd0qkaA0
419,"test broadcast for KUMU LIVE, Jan 29, FRI",General / Other,English,Numberbender (Main),2021-01-28,unique,,https://www.youtube.com/watch?v=6jS-H6ajWtw
420,TIPS AND TRICKS ON ANSWERING PERCENTAGES PROBLEMS | Paano Gumaling Sa Math,Algebra,Filipino,Numberbender (Main),2021-01-25,unique,,https://www.youtube.com/watch?v=fdwpC3MJnPk
421,"test broadcast for KUMU live,  jan 22, Friday",General / Other,English,Numberbender (Main),2021-01-21,unique,,https://www.youtube.com/watch?v=Iao7unYq52E
422,ONLINE SCHOOL ROUTINE | LEARNING IN THE MIDDLE OF A PANDEMIC,General / Other,English,Numberbender (Main),2021-01-19,unique,,https://www.youtube.com/watch?v=-CW3VXT-tdg
423,LOST IN TRANSLATION -- CONQUERING THE FEAR OF WORD PROBLEMS| Paano Gumaling Sa Math | Kumu LIVE,Calculus,Filipino,Numberbender (Main),2021-01-18,unique,,https://www.youtube.com/watch?v=bR1Aprdwxno
424,"test brodcast for KUMU Live - Friday, 1030am",General / Other,English,Numberbender (Main),2021-01-14,unique,,https://www.youtube.com/watch?v=L9FrZxKAFFY
425,PREDICTING OUTCOMES IN 2021 | PAANO GUMALING SA MATH | KUMU LIVE | EP11,Statistics,Filipino,Numberbender (Main),2021-01-11,unique,,https://www.youtube.com/watch?v=x18CJFrWF1s
426,HOW TO SUCCEED IN AN ONLINE CLASS | KUMU LIVE | EP10,General / Other,English,Numberbender (Main),2021-01-04,unique,,https://www.youtube.com/watch?v=nuHgsRk9PpM
427,test broadcast,General / Other,English,Numberbender (Main),2021-01-03,unique,,https://www.youtube.com/watch?v=SRAs1TL3hS0
428,BAKIT BA HINAHANAP PA DIN SI X? | PAANO GUMALING SA MATH | Kumu Live | EP9,Algebra,Filipino,Numberbender (Main),2020-12-21,unique,,https://www.youtube.com/watch?v=V-9cjFaxuzI
429,Simplifying Square Roots | Paano Gumaling Sa Math?| EP7,Algebra,Filipino,Numberbender (Main),2020-12-14,unique,,https://www.youtube.com/watch?v=0NUQRyp6ndk
430,HOW TO SIMPLIFY ALGEBRAIC EXPRESSIONS | ALGEBRA,Algebra,English,Numberbender (Main),2020-12-09,unique,,https://www.youtube.com/watch?v=lHXM0qNqN5U
431,PAANO MAG-SIMPLIFY NG ALGEBRAIC EXPRESSIONS | ALGEBRA,Algebra,Filipino,Numberbender (Main),2020-12-09,unique,,https://www.youtube.com/watch?v=6YRP1x7HZ6A
432,OVERCOMING YOUR FRACTION ANXIETY | PAANO BA GUMALING SA MATH | KUMU LIVE | EP6,General / Other,Filipino,Numberbender (Main),2020-12-07,unique,,https://www.youtube.com/watch?v=GQIidxxMv34
433,PAANO BA'NG MAGING YOUTUBER? | KUMU LIVE | EP4,General / Other,Filipino,Numberbender (Main),2020-12-04,unique,,https://www.youtube.com/watch?v=lFvboOvyxYQ
434,BAKIT MARAMING TAKOT SA CALCULUS? | KUMU LIVE | EP 3,Calculus,Filipino,Numberbender (Main),2020-11-30,unique,,https://www.youtube.com/watch?v=s3ULN-d3Lsk
435,DR.E LIVE | BAKIT MASARAP MAGING TEACHER | SEENZONE AT KUMU,General / Other,English,Numberbender (Main),2020-11-27,unique,,https://www.youtube.com/watch?v=UXVBE0YRCWY
436,1st test broadcast - KUMU LIVE,General / Other,English,Numberbender (Main),2020-11-26,unique,,https://www.youtube.com/watch?v=rNBMqjnhWrk
437,3rd test brodcast for KUMU,General / Other,English,Numberbender (Main),2020-11-26,unique,,https://www.youtube.com/watch?v=NWCejoCropk
438,2nd test broadcast | APPLICATIONS AND TECHNOLOGY I USE DURING MY LIVE STREAMING,General / Other,English,Numberbender (Main),2020-11-25,unique,,https://www.youtube.com/watch?v=1p-FCV20LlM
439,FIRST Kumu Stream with Knowledge Channel,General / Other,Filipino,Numberbender (Main),2020-11-23,unique,,https://www.youtube.com/watch?v=9Mukz6D37iY
440,HOW TO LEVEL UP YOUR WEBCAM FOR A HIGH-DEFINITION ZOOM MEETING AND LIVE STREAMING,General / Other,English,Numberbender (Main),2020-11-09,unique,,https://www.youtube.com/watch?v=3rkOweNUX8k
441,LECTURE ON HYPOTHESIS TESTING FOR MEAN USING TECHNOLOGY | STATISTICS,Statistics,Filipino,Numberbender (Main),2020-11-09,unique,,https://www.youtube.com/watch?v=TzBlbTQTU7E
442,IN 'N OUT MUKBANG WHILE WAITING FOR MY 2nd SILVER PLAY BUTTON,General / Other,Filipino,Numberbender (Main),2020-11-02,unique,,https://www.youtube.com/watch?v=JvzMomIOhjM
443,HOW MY STANDING DESK INCREASED MY PRODUCTIVITY AND CREATIVITY WHILE WORKING REMOTELY,General / Other,English,Numberbender (Main),2020-10-26,unique,,https://www.youtube.com/watch?v=r_uIV2zlrhw
444,HOW DO YOU ADD AND SUBTRACT POSITIVE AND NEGATIVE NUMBERS: INTEGERS | MATH IN A MINUTE,Algebra,Filipino,Numberbender (Main),2020-10-21,unique,,https://www.youtube.com/watch?v=qQaQlBhIZmM
